{"$schema":"https://json-schema.org/draft/2020-12/schema","$id":"https://eliasworks.dev/blueprint/0.5.5-dev/generic-compliance-manifest.schema.json","title":"Blueprint 0.5.5-dev Generic Compliance Manifest","type":"object","required":["schema_version","consumer","blueprint","authority","capabilities","scope","evidence","assessments"],"properties":{"schema_version":{"const":"0.5.5-dev"},"consumer":{"type":"object","required":["id","repository"],"properties":{"id":{"type":"string","pattern":"^[a-z0-9][a-z0-9._-]*$"},"repository":{"type":"string","pattern":"^[^/]+/[^/]+$"},"snapshot":{"type":"string","pattern":"^[a-f0-9]{40}$"}},"additionalProperties":false},"blueprint":{"type":"object","required":["adopted_version","evaluation_version","workflow_mode"],"properties":{"adopted_version":{"type":"string","minLength":1},"evaluation_version":{"const":"0.5.5-dev"},"workflow_mode":{"enum":["greenfield","brownfield"]}},"additionalProperties":false},"authority":{"type":"object","required":["api_mode"],"properties":{"api_mode":{"enum":["api_backed","api_optional"]}},"additionalProperties":false},"capabilities":{"type":"object","properties":{"web":{"type":"boolean"},"android":{"type":"boolean"},"ios":{"type":"boolean"},"database":{"type":"boolean"},"mobile_licensing":{"type":"boolean"},"saas":{"type":"boolean"},"multi_tenant":{"type":"boolean"},"offline_mobile":{"type":"boolean"},"redis":{"type":"boolean"},"docker":{"type":"boolean"}},"additionalProperties":{"type":"boolean"}},"conditions":{"type":"object","additionalProperties":{"type":"boolean"}},"scope":{"type":"object","required":["mode"],"properties":{"mode":{"enum":["full","selected"]},"check_ids":{"type":"array","minItems":1,"uniqueItems":true,"items":{"type":"string","minLength":1}}},"allOf":[{"if":{"properties":{"mode":{"const":"selected"}},"required":["mode"]},"then":{"required":["check_ids"]}},{"if":{"properties":{"mode":{"const":"full"}},"required":["mode"]},"then":{"not":{"required":["check_ids"]}}}],"additionalProperties":false},"evidence":{"type":"array","uniqueItems":false,"items":{"type":"object","required":["id","path","kind","state"],"properties":{"id":{"type":"string","pattern":"^EV-[A-Z0-9][A-Z0-9._-]*$"},"path":{"type":"string","minLength":1},"kind":{"enum":["file","evidence","manual","policy","runtime","report","other"]},"state":{"enum":["PRESENT","STALE","MISSING"]},"blueprint_version":{"type":"string","minLength":1},"grandfathered":{"type":"boolean","default":false},"accepted_for":{"type":"array","uniqueItems":true,"items":{"type":"string","minLength":1}},"note":{"type":"string"}},"additionalProperties":false}},"assessments":{"type":"array","items":{"type":"object","required":["check_id","declared_status"],"properties":{"check_id":{"type":"string","minLength":1},"declared_status":{"enum":["PASS","FAIL","N/A","BLOCKED"]},"evidence_refs":{"type":"array","uniqueItems":true,"items":{"type":"string","pattern":"^EV-[A-Z0-9][A-Z0-9._-]*$"}},"reason_code":{"enum":["CONTRACT_VIOLATION","MISSING_EVIDENCE","STALE_EVIDENCE","VERSION_MISMATCH","PREREQUISITE_BLOCKED","NOT_APPLICABLE"]},"rationale":{"type":"string","minLength":1},"blocked_by":{"type":"array","minItems":1,"uniqueItems":true,"items":{"type":"string","minLength":1}}},"allOf":[{"if":{"properties":{"declared_status":{"const":"PASS"}},"required":["declared_status"]},"then":{"required":["evidence_refs"],"properties":{"evidence_refs":{"minItems":1}}}},{"if":{"properties":{"declared_status":{"const":"N/A"}},"required":["declared_status"]},"then":{"required":["reason_code","rationale"],"properties":{"reason_code":{"const":"NOT_APPLICABLE"}}}},{"if":{"properties":{"declared_status":{"const":"BLOCKED"}},"required":["declared_status"]},"then":{"required":["reason_code","rationale","blocked_by"],"properties":{"reason_code":{"const":"PREREQUISITE_BLOCKED"}}}},{"if":{"properties":{"declared_status":{"const":"FAIL"}},"required":["declared_status"]},"then":{"required":["reason_code","rationale"],"properties":{"reason_code":{"enum":["CONTRACT_VIOLATION","MISSING_EVIDENCE","STALE_EVIDENCE","VERSION_MISMATCH"]}}}}],"additionalProperties":false}}},"additionalProperties":false}
