{
  "schema_version": "0.5.5-dev",
  "consumer": {
    "id": "generic-api-backed",
    "repository": "example/api-backed"
  },
  "blueprint": {
    "adopted_version": "0.5.4",
    "evaluation_version": "0.5.5-dev",
    "workflow_mode": "greenfield"
  },
  "authority": {
    "api_mode": "api_backed"
  },
  "capabilities": {
    "web": true,
    "android": false,
    "ios": false,
    "database": true,
    "mobile_licensing": false
  },
  "scope": {
    "mode": "selected",
    "check_ids": [
      "discovery.product_vision",
      "api.auth_strategy",
      "qa.real_api_transport",
      "qa.security",
      "review.human_complete"
    ]
  },
  "evidence": [
    {
      "id": "EV-VISION",
      "path": "docs/product-vision.md",
      "kind": "evidence",
      "state": "PRESENT",
      "blueprint_version": "0.5.4"
    },
    {
      "id": "EV-AUTH",
      "path": "docs/security/auth-strategy.md",
      "kind": "evidence",
      "state": "PRESENT",
      "blueprint_version": "0.5.4"
    },
    {
      "id": "EV-API",
      "path": "reports/api-transport.json",
      "kind": "runtime",
      "state": "PRESENT",
      "blueprint_version": "0.5.4"
    },
    {
      "id": "EV-SEC",
      "path": "reports/security-qa.md",
      "kind": "report",
      "state": "PRESENT",
      "blueprint_version": "0.5.4"
    },
    {
      "id": "EV-HUMAN",
      "path": "evidence/human-acceptance.md",
      "kind": "manual",
      "state": "PRESENT",
      "blueprint_version": "0.5.4"
    }
  ],
  "assessments": [
    {
      "check_id": "discovery.product_vision",
      "declared_status": "PASS",
      "evidence_refs": ["EV-VISION"]
    },
    {
      "check_id": "api.auth_strategy",
      "declared_status": "PASS",
      "evidence_refs": ["EV-AUTH"]
    },
    {
      "check_id": "qa.real_api_transport",
      "declared_status": "PASS",
      "evidence_refs": ["EV-API"]
    },
    {
      "check_id": "qa.security",
      "declared_status": "PASS",
      "evidence_refs": ["EV-SEC"]
    },
    {
      "check_id": "review.human_complete",
      "declared_status": "PASS",
      "evidence_refs": ["EV-HUMAN"]
    }
  ]
}
